{
  "schema_version": "1.0",
  "claimed_total_base_units": "180674489737",
  "claimed_count": 1,
  "transfers": [
    {
      "chain_id": 11155111,
      "token_address": "0x7b79995e5f793A07Bc00c21412e50Ecae098E7f9",
      "transaction_hash": "0x0442da2dc2aa4e4557e648fe3a6fad49c43f5e9db89b36e156f1a790d3b64b6f",
      "log_index": 128,
      "block_number": 11855664,
      "block_hash": "0xa34d4187a82b7db3d805d896b100403e634c0abdc7fa61756e05217369de8cb7",
      "from_address": "0x4c78402270506eD073E05d4f0a02406bCc386560",
      "to_address": "0x315E5193633A962B3F369F9C3833D973D0588cCD",
      "amount_base_units": "180674489737",
      "token_decimals": 18,
      "source": "service"
    }
  ]
}
